{
  "approved": true,
  "preview_evidence": [
    ".ai/runs/2026-03-14T10-13-00.728Z_goodbye-harmonic-annotations/evidence/goodbye-annotations-min-text-fix.png",
    ".ai/runs/2026-03-14T10-13-00.728Z_goodbye-harmonic-annotations/evidence/goodbye-annotations-min-text-fix-mobile.png"
  ],
  "summary": {
    "status": "pass_with_followups",
    "rationale": "The refinement corrected the missed minimum text-size issue by bringing the smallest songs-surface text up to 12px while preserving the inline-annotation treatment and pane-width fit."
  },
  "findings": [],
  "section_scores": [
    {
      "section_id": "songs-library",
      "score": 0.94,
      "notes": [
        "The smallest visible labels now meet a 12px minimum.",
        "The larger annotation text does not collapse representative desktop or mobile rows."
      ]
    }
  ],
  "profile_assessment": {
    "selected_profile_id": null,
    "fit_score": 0.93,
    "anti_patterns_detected": [],
    "notes": [
      "The fix improved accessibility without introducing extra UI chrome."
    ]
  },
  "gates": {
    "hard_rules_passed": true,
    "needs_human_review": false,
    "requires_refinement": false
  },
  "next_steps": [
    "Translate remaining English UI chrome in the songs viewer if full Korean consistency is required."
  ]
}
