{
  "approved": true,
  "preview_evidence": [
    "Browser verification at http://localhost:3000/quiz collected 40 rendered quiz prompts and found 0 natural 1-degree questions."
  ],
  "summary": {
    "status": "pass",
    "rationale": "The change removes one random prompt candidate without altering layout or visual hierarchy."
  },
  "findings": [],
  "section_scores": [
    {
      "section_id": "behavior_fit",
      "score": 1,
      "notes": [
        "The quiz continues to render normally and no longer asks natural 1-degree questions."
      ]
    }
  ],
  "profile_assessment": {
    "selected_profile_id": "warm-restrained-editorial-utility",
    "fit_score": 1,
    "anti_patterns_detected": [],
    "notes": [
      "No visual changes were introduced."
    ]
  },
  "gates": {
    "hard_rules_passed": true,
    "needs_human_review": false,
    "requires_refinement": false
  },
  "next_steps": []
}
