{
  "approved": true,
  "preview_evidence": [
    "verify.json records that no rendered product surface changed, so browser screenshots are not applicable.",
    "The supplied recording produced separate evidence artifacts with 124 non-authoritative chord-candidate and recurrence entries.",
    "Contract and validator checks preserve tempo, grid, key, chord, and recurrence ambiguity for agent adjudication."
  ],
  "summary": {
    "status": "pass",
    "rationale": "The refined non-visual workflow clearly separates deterministic measurement from musical judgment, exposes partial and error states, and gives agents inspectable alternatives without presenting numeric rank as a final decision."
  },
  "findings": [],
  "section_scores": [
    {
      "section_id": "hard_rules",
      "score": 10,
      "notes": [
        "No rendered UI or theme surface changed.",
        "The workflow preserves the required evidence-versus-decision boundary."
      ]
    },
    {
      "section_id": "ux_heuristics",
      "score": 9,
      "notes": [
        "Evidence-ready, partial-evidence, missing-dependency, and validation-error states are explicit.",
        "Actionable diagnostics and bounded candidate summaries support efficient agent review."
      ]
    },
    {
      "section_id": "aesthetic_judgment",
      "score": 10,
      "notes": [
        "Not applicable to this non-visual skill and tooling change; no visual regression surface exists."
      ]
    }
  ],
  "profile_assessment": {
    "selected_profile_id": null,
    "fit_score": 10,
    "anti_patterns_detected": [],
    "notes": [
      "A visual aesthetic profile is not applicable to a skill contract, Python tooling, and JSON artifacts."
    ]
  },
  "gates": {
    "hard_rules_passed": true,
    "needs_human_review": false,
    "requires_refinement": false
  },
  "next_steps": [
    "Route the refined implementation to Code Critic."
  ]
}
