{
  "approved": true,
  "preview_evidence": [
    ".ai/runs/2026-03-14T05-54-59.424Z_supervisor-workflow-improvements/evidence/songs-proof.png"
  ],
  "summary": {
    "status": "pass_with_followups",
    "rationale": "The workflow now captures the specific layout failure modes discovered during the songs work, especially redundant labels, width-first fit, and screenshot-backed row checks."
  },
  "findings": [],
  "section_scores": [
    {
      "section_id": "hard_rules",
      "score": 0.94,
      "notes": [
        "The workflow contract now carries visual verification structure instead of only prose guidance."
      ]
    },
    {
      "section_id": "ux_heuristics",
      "score": 0.95,
      "notes": [
        "The updated prompts direct design and verification attention to real layout regressions seen in dense operator surfaces.",
        "Planner and Builder guidance reduce the chance that data-shape and render changes get entangled in one opaque task."
      ]
    },
    {
      "section_id": "aesthetic_judgment",
      "score": 0.9,
      "notes": [
        "The workflow remains lightweight while becoming more specific about practical visual quality."
      ]
    }
  ],
  "profile_assessment": {
    "selected_profile_id": "warm-restrained-editorial-utility",
    "fit_score": 0.89,
    "anti_patterns_detected": [],
    "notes": [
      "The rules prefer calm, width-aware, information-dense layouts over decorative spacing fixes."
    ]
  },
  "gates": {
    "hard_rules_passed": true,
    "needs_human_review": false,
    "requires_refinement": false
  },
  "next_steps": [
    "If the verify checklist becomes common across projects, consider promoting the representative-row checks into a reusable template or action."
  ]
}
