{
  "approved": true,
  "preview_evidence": [
    ".ai/runs/2026-07-24T03-21-18.491Z_remove-voicings-music-fonts-modern-nav/evidence/before-desktop.png",
    ".ai/runs/2026-07-24T03-21-18.491Z_remove-voicings-music-fonts-modern-nav/evidence/before-mobile.png",
    ".ai/runs/2026-07-24T03-21-18.491Z_remove-voicings-music-fonts-modern-nav/evidence/after-desktop.png",
    ".ai/runs/2026-07-24T03-21-18.491Z_remove-voicings-music-fonts-modern-nav/evidence/after-mobile.png"
  ],
  "summary": {
    "status": "pass",
    "rationale": "The GNB is materially clearer and more mobile-friendly: a 113px two-row cluster of 36px pills became a 65px single-row product header with a concise brand anchor, two direct 44px-or-larger destinations, semantic active state, and no overflow at the required 390px width. The result preserves the product surface while removing decorative navigation chrome."
  },
  "findings": [],
  "section_scores": [
    {
      "section_id": "hard_rules",
      "score": 5,
      "notes": [
        "The primary navigation exposes only supported destinations.",
        "aria-current, semantic links, document-order focus, and visible 2px outlines cover active and keyboard states.",
        "No destructive or asynchronous behavior was introduced."
      ]
    },
    {
      "section_id": "ux_heuristics",
      "score": 5,
      "notes": [
        "Both destinations remain immediately visible on mobile, avoiding unnecessary disclosure behind a menu.",
        "The 390px layout stays on one row with 44px and 64px targets and no document overflow.",
        "The old subtitle, stale destinations, and redundant pill containers are absent.",
        "The active underline and text contrast remain consistent between Canvas and Songs."
      ]
    },
    {
      "section_id": "aesthetic_judgment",
      "score": 5,
      "notes": [
        "The product-craft-workbench profile is expressed through restrained Geist typography, stable gutters, semantic neutrals, and one purposeful active indicator.",
        "The design avoids filled chips, shadows, gradients, icons, badges, visual-noise stacking, and false spaciousness.",
        "The header balances brand presence with working-content priority and consumes 48 fewer vertical pixels on mobile."
      ]
    }
  ],
  "profile_assessment": {
    "selected_profile_id": "product-craft-workbench",
    "fit_score": 5,
    "anti_patterns_detected": [],
    "notes": [
      "The final served header uses Geist / Geist Fallback and existing semantic Tailwind/shadcn tokens.",
      "No unapproved global token, theme variable, semantic CSS class, or unrelated visual system was introduced.",
      "Relevant Next.js, shadcn, Geist, React, and browser guidance was applied without adding a component abstraction that two direct links do not need."
    ]
  },
  "gates": {
    "hard_rules_passed": true,
    "needs_human_review": false,
    "requires_refinement": false
  },
  "next_steps": []
}
