{
  "approved": true,
  "preview_evidence": [
    "/Users/indegser/.agent-browser/tmp/screenshots/screenshot-2026-07-11T02-36-20-727Z-mvmtx5.png",
    "/Users/indegser/.agent-browser/tmp/screenshots/screenshot-2026-07-11T02-38-31-078Z-17dc3o.png",
    "/Users/indegser/.agent-browser/tmp/screenshots/screenshot-2026-07-11T02-38-41-788Z-i0d4zh.png"
  ],
  "summary": {
    "status": "pass",
    "rationale": "The change removes a misleading temporary sample row without altering layout, styling, or interaction patterns. The songs index remains scannable, count metadata updates correctly, and a representative detail page still renders."
  },
  "findings": [],
  "section_scores": [
    {
      "section_id": "hard_rules",
      "score": 5,
      "notes": [
        "No destructive action or new workflow was introduced.",
        "Existing empty and not-found states remain intact.",
        "The list keeps one obvious row-level action: open a song."
      ]
    },
    {
      "section_id": "ux_heuristics",
      "score": 5,
      "notes": [
        "Removing the temporary sample reduces unnecessary choice.",
        "Remaining rows retain consistent hierarchy and metadata.",
        "Browser evidence confirms no redundant labels or avoidable overflow were introduced."
      ]
    },
    {
      "section_id": "aesthetic_judgment",
      "score": 5,
      "notes": [
        "No visual restyling was introduced.",
        "The warm restrained editorial utility profile is preserved.",
        "No banned visual-noise or marketing-shell patterns were added."
      ]
    }
  ],
  "profile_assessment": {
    "selected_profile_id": "warm-restrained-editorial-utility",
    "fit_score": 5,
    "anti_patterns_detected": [],
    "notes": [
      "The result improves density fit by removing a sample-only row while preserving the existing calm list treatment."
    ]
  },
  "gates": {
    "hard_rules_passed": true,
    "needs_human_review": false,
    "requires_refinement": false
  },
  "next_steps": []
}
