{
  "approved": true,
  "preview_evidence": [
    "Browser verification at http://localhost:3000/songs showed the Songs page rendering normally after removing music-analysis-derived entries.",
    "Browser verification at http://localhost:3000/quiz showed the Quiz page still rendering normally."
  ],
  "summary": {
    "status": "pass",
    "rationale": "No visual redesign was introduced. The only rendered-surface impact was removal of analysis-derived song data, and the remaining Songs page layout still renders cleanly."
  },
  "findings": [],
  "section_scores": [
    {
      "section_id": "layout_integrity",
      "score": 1,
      "notes": [
        "Existing layout remains intact."
      ]
    },
    {
      "section_id": "scope_control",
      "score": 1,
      "notes": [
        "Cleanup stayed focused on music-analysis package, skill, references, docs, run artifacts, and derived song data."
      ]
    }
  ],
  "profile_assessment": {
    "selected_profile_id": "warm-restrained-editorial-utility",
    "fit_score": 1,
    "anti_patterns_detected": [],
    "notes": [
      "No new aesthetic patterns were introduced."
    ]
  },
  "gates": {
    "hard_rules_passed": true,
    "needs_human_review": false,
    "requires_refinement": false
  },
  "next_steps": []
}
