{
  "approved": true,
  "preview_evidence": [
    "browser-evidence.json: Supervisor before/after screenshots, width and timing observations, error/retry verification.",
    "Design Critic CUA Edge tab 1529780145 at http://localhost:3007/practice: conversation screenshot at 320x700 ready state shows complete four-row chart and transport; screenshot at 390x760 playing state shows Fmaj7 active region and all chart labels.",
    "Design Critic directly played and paused via sole transport. Read-only DOM observation at390px confirmed document width390 equals scrollWidth390; transport144x48px; paused Am7 retains aria-current chord semantics. Temporary viewport override reset after review."
  ],
  "summary": {
    "status": "pass",
    "rationale": "Implementation follows the approved minimal mobile wireframe: aligned scale bands, equal measure widths, clear half-bar divisions, readable chord symbols and one transport with automatic repeat indicated. No additional theory or dashboard panels."
  },
  "findings": [],
  "section_scores": [
    {
      "section_id": "hard_rules",
      "score": 5,
      "notes": ["Required ready/loading/buffering/paused/error/retry states are specified and verified or code-reviewed in verify.json.", "One visible primary transport;44px minimum target exceeded. No destructive workflow.", "No new semantic classes or global theme variables; existing semantic utilities visibly render borders, active contrast and typography."]
    },
    {
      "section_id": "ux_heuristics",
      "score": 4.5,
      "notes": ["320px ready screenshot fits complete chart and primary button without horizontal scroll; long scale and split symbols remain readable.", "Measure numbers appear once and scale labels align to the relevant bars. Navigation safely wraps to two rows.", "Error/retry evidence retains chart and reuses sole transport. Physical phone listening has not been tested; buffering was reviewed rather than forced by network throttling."]
    },
    {
      "section_id": "aesthetic_judgment",
      "score": 4.5,
      "notes": ["Musical measures and subdivisions determine hierarchy, with semantic contrast reserved for the sounding chord.", "Compact spacing keeps a useful first viewport; no cards, decorative badges, motion noise or redundant Current/Next labels.", "Songs score rendering is outside this review scope and remains unchanged."]
    }
  ],
  "profile_assessment": {
    "selected_profile_id": "music-visual-instrument",
    "fit_score": 5,
    "anti_patterns_detected": [],
    "notes": ["Profile is recorded in design.json; implementation follows semantic theme-usage guidance without global token additions.", "Local website workflow and design-rule-engine govern review. Unavailable optional Vercel design skills were not claimed or required; available implementation review guidance is recorded in build.json."]
  },
  "gates": {
    "hard_rules_passed": true,
    "needs_human_review": false,
    "requires_refinement": false
  },
  "next_steps": ["Proceed with Code Critic and the approved GitHub/Vercel release workflow. Actual phone audio behavior remains a stated verification limit, not a release-blocking design defect."]
}
