{
  "approved": true,
  "preview_evidence": [
    "/Users/indegser/.agent-browser/tmp/screenshots/screenshot-2026-07-11T02-41-34-802Z-ufwgu5.png",
    "/Users/indegser/.agent-browser/tmp/screenshots/screenshot-2026-07-11T02-44-18-246Z-1ayh8g.png",
    "/Users/indegser/.agent-browser/tmp/screenshots/screenshot-2026-07-11T02-44-28-964Z-zofpcd.png"
  ],
  "summary": {
    "status": "pass",
    "rationale": "The songs index now behaves like a compact working list. Redundant header copy, long visible summaries, and long key-center row strings were removed without changing navigation or adding visual noise."
  },
  "findings": [],
  "section_scores": [
    {
      "section_id": "hard_rules",
      "score": 5,
      "notes": [
        "The empty state remains present.",
        "There is still one primary row action: open a song.",
        "No destructive action or unsafe workflow was introduced."
      ]
    },
    {
      "section_id": "ux_heuristics",
      "score": 5,
      "notes": [
        "Scanability improved by reducing prose density.",
        "Representative rows fit desktop and mobile widths.",
        "No avoidable redundant local labels or stacked explanations were added."
      ]
    },
    {
      "section_id": "aesthetic_judgment",
      "score": 5,
      "notes": [
        "The restrained warm utility profile is preserved.",
        "The page now uses whitespace for grouping rather than marketing-style air.",
        "No banned visual-noise stack, high-chroma accent, or nested-card pattern was introduced."
      ]
    }
  ],
  "profile_assessment": {
    "selected_profile_id": "warm-restrained-editorial-utility",
    "fit_score": 5,
    "anti_patterns_detected": [],
    "notes": [
      "The result is quieter and denser while retaining the existing tone and row interaction."
    ]
  },
  "gates": {
    "hard_rules_passed": true,
    "needs_human_review": false,
    "requires_refinement": false
  },
  "next_steps": []
}
