{
  "approved": true,
  "preview_evidence": [
    ".ai/runs/2026-07-24T05-54-41.810Z_compact-chord-notation/evidence/coherence-neutral-whole-font-grid.png",
    ".ai/runs/2026-07-24T05-54-41.810Z_compact-chord-notation/evidence/scheherazade-final-375-dpr3.png",
    ".ai/runs/2026-07-24T05-54-41.810Z_compact-chord-notation/evidence/scheherazade-final-390-dpr3-hires.png",
    ".ai/runs/2026-07-24T05-54-41.810Z_compact-chord-notation/evidence/scheherazade-final-430-dpr3.png",
    ".ai/runs/2026-07-24T05-54-41.810Z_compact-chord-notation/evidence/scheherazade-final-flat9.png",
    ".ai/runs/2026-07-24T05-54-41.810Z_compact-chord-notation/evidence/scheherazade-final-sharp9.png",
    ".ai/runs/2026-07-24T05-54-41.810Z_compact-chord-notation/evidence/scheherazade-final-desktop-1024.png"
  ],
  "summary": {
    "status": "pass",
    "rationale": "The final score reproduces the user-selected Scheherazade comparison direction as one coherent type family. Compact baseline qualities remain legible, true alterations keep their hierarchy, and dense mobile rows fit without collisions."
  },
  "findings": [],
  "section_scores": [
    {
      "section_id": "hard_rules",
      "score": 1,
      "notes": [
        "The rejected Edwin treatment is absent from rendered document chords and served component CSS.",
        "All required mobile and desktop browser evidence is present.",
        "Representative rows contain no redundant labels, horizontal overflow, or detected chord collisions."
      ]
    },
    {
      "section_id": "ux_heuristics",
      "score": 4.9,
      "notes": [
        "Roots and suffixes read as a unified scan unit while the 72% quality scale reduces crowding.",
        "Inline root and bass accidentals stay attached to their note names, while true alterations remain distinctly raised."
      ]
    },
    {
      "section_id": "aesthetic_judgment",
      "score": 5,
      "notes": [
        "The result directly follows the comparison option selected by the user.",
        "The Scheherazade triangle and minus have restrained, compatible proportions beside the letterforms and extension figures."
      ]
    }
  ],
  "profile_assessment": {
    "selected_profile_id": "music-visual-instrument",
    "fit_score": 1,
    "anti_patterns_detected": [],
    "notes": [
      "The notation remains grounded in the score surface and the established jazz shorthand hierarchy.",
      "One chord type family avoids the mixed-register mismatch rejected in earlier refinements."
    ]
  },
  "gates": {
    "hard_rules_passed": true,
    "needs_human_review": false,
    "requires_refinement": false
  },
  "next_steps": []
}
