{
  "approved": true,
  "preview_evidence": [
    "evidence/before-390.png",
    "evidence/library-390.png",
    "evidence/player-320.png",
    "evidence/player-390.png",
    "evidence/playing-320.png"
  ],
  "summary": {
    "status": "pass",
    "rationale": "Existing musical grid preserved; new track title, metadata and eight measures fit at320/390px. No layout or CSS changes."
  },
  "findings": [],
  "section_scores": [
    {
      "section_id": "hard_rules",
      "score": 5,
      "notes": [
        "State coverage and action hierarchy pass; no destructive actions"
      ]
    },
    {
      "section_id": "ux_heuristics",
      "score": 4.5,
      "notes": [
        "No redundant panels, width-aware musical rows; error retry remains local"
      ]
    },
    {
      "section_id": "aesthetic_judgment",
      "score": 4.5,
      "notes": [
        "Music Visual Instrument fit; only sounding chord and transport emphasized"
      ]
    }
  ],
  "profile_assessment": {
    "selected_profile_id": "music-visual-instrument",
    "fit_score": 4.5,
    "anti_patterns_detected": [],
    "notes": [
      "No global theme tokens or decorative cards added"
    ]
  },
  "gates": {
    "hard_rules_passed": true,
    "needs_human_review": false,
    "requires_refinement": false
  },
  "next_steps": []
}
