{
  "approved": true,
  "preview_evidence": [
    "specs/design-rule-engine/design-tokens.template.json",
    "src/app/globals.css",
    "specs/design-rule-engine/aesthetic-profile.json"
  ],
  "summary": {
    "status": "pass_with_followups",
    "rationale": "The draft token baseline now expresses the selected warm restrained editorial utility profile with concrete spacing, type, color, radius, shadow, and grid values while staying bound to the current styling layer."
  },
  "findings": [
    {
      "id": "display-face-still-open",
      "severity": "low",
      "layer": "aesthetic_judgment",
      "message": "Display typography remains Geist-based, which is acceptable for the draft baseline but may limit how editorial the system can feel if future surfaces need stronger typographic distinction.",
      "screen_id": "design-token-foundation",
      "area": "typography",
      "recommendation": "Re-evaluate display family binding after more browser evidence exists from token-driven surfaces.",
      "evidence": [
        "specs/design-rule-engine/design-tokens.template.json",
        "src/app/globals.css"
      ]
    }
  ],
  "section_scores": [
    {
      "section_id": "hard_rules",
      "score": 0.96,
      "notes": [
        "Spacing now uses a finite modular scale instead of undecided placeholders.",
        "The token baseline stays compatible with the current Tailwind/CSS variable binding."
      ]
    },
    {
      "section_id": "ux_heuristics",
      "score": 0.91,
      "notes": [
        "Typography and spacing choices support scanability and operational clarity.",
        "The baseline remains explicit about what is still draft rather than hiding open decisions."
      ]
    },
    {
      "section_id": "aesthetic_judgment",
      "score": 0.9,
      "notes": [
        "The selected warm paper and stone neutrals fit the current songs surface direction.",
        "Accent restraint and low-shadow guidance avoid luxury-signaling drift."
      ]
    }
  ],
  "profile_assessment": {
    "selected_profile_id": "warm-restrained-editorial-utility",
    "fit_score": 0.92,
    "anti_patterns_detected": [],
    "notes": [
      "The baseline stays warm, low-saturation, and hierarchy-led rather than cold or overly brand-signaling.",
      "No saturated-accent breakout or ornamental fragmentation was introduced."
    ]
  },
  "gates": {
    "hard_rules_passed": true,
    "needs_human_review": false,
    "requires_refinement": false
  },
  "next_steps": [
    "Normalize high-traffic product surfaces against the new draft tokens in a separate implementation run.",
    "Collect browser evidence from token-driven UI updates before deciding whether a dedicated display face is necessary."
  ]
}
